{
  "journey_id": "diagnostico_psicologico_v1",
  "name": "Diagnóstico Psicológico y Biodescodificación",
  "version": "1.0.0",
  "description": "Protocolo de 10 pasos para el diagnóstico basado en biodescodificación.",
  "steps": [
    {
      "step": 1,
      "name": "Acogida & Perfilado",
      "agent_role": "Terapeuta de Acogida",
      "system_prompt": "Eres un terapeuta experto en biodescodificación. Tu objetivo es dar la bienvenida al consultante y extraer sus datos básicos de perfilado de forma empática. Debes obtener: nombre, edad, sexo y lateralidad (diestro/zurdo). Responde siempre con un tono cálido y profesional en español. Al final de tu respuesta, DEBES incluir un bloque JSON con los datos extraídos.",
      "user_prompt_template": "Usuario dice: {{user_message}}\nDatos actuales: {{session_data}}",
      "expected_output": {
        "type": "object",
        "properties": {
          "nombre": { "type": "string" },
          "edad": { "type": "integer" },
          "sexo": { "type": "string" },
          "lateralidad": { "type": "string", "enum": ["diestro", "zurdo", "ambidiestro"] }
        }
      },
      "transitions": { "default": 2 },
      "llm": { "model": "deepseek-chat", "temperature": 0.7, "max_tokens": 1000 }
    },
    {
      "step": 2,
      "name": "Triaje MC",
      "agent_role": "Analista de Motivo de Consulta",
      "system_prompt": "Analiza el motivo de consulta (MC) del consultante. Determina si es un síntoma biológico (enfermedad, dolor físico) o no biológico (problemas de pareja, dinero, trabajo). Extrae el tipo de MC, la descripción cruda y una hipótesis preliminar del código biológico (CB) si aplica. Responde en español y añade el bloque JSON al final.",
      "user_prompt_template": "Usuario dice: {{user_message}}\nContexto: {{session_data}}",
      "expected_output": {
        "type": "object",
        "properties": {
          "mc_type": { "type": "string", "enum": ["biological", "non_biological"] },
          "mc_raw": { "type": "string" },
          "cb_preliminar": { "type": "string" }
        },
        "required": ["mc_type", "mc_raw"]
      },
      "transitions": {
        "mc_type == 'biological'": 3,
        "mc_type == 'non_biological'": 5
      },
      "llm": { "model": "deepseek-chat", "temperature": 0.3, "max_tokens": 1000 }
    },
    {
      "step": 3,
      "name": "Validación CB",
      "agent_role": "Especialista en Diccionario Biológico",
      "system_prompt": "Utiliza el conocimiento de biodescodificación para validar el código biológico del síntoma físico. Debes ser preciso y técnico pero comprensible. Extrae el código biológico exacto y su descripción de conflicto emocional. Usa RAG para buscar en el diccionario si es necesario. Responde en español con bloque JSON.",
      "user_prompt_template": "Síntoma: {{session_data.mc_raw}}\nContexto RAG: {{rag_context}}",
      "expected_output": {
        "type": "object",
        "properties": {
          "cb_code": { "type": "string" },
          "cb_description": { "type": "string" }
        },
        "required": ["cb_code", "cb_description"]
      },
      "transitions": { "default": 4 },
      "llm": { "model": "deepseek-chat", "temperature": 0.5, "max_tokens": 1000 },
      "rag_query": "diccionario biodescodificacion conflicto emocional para {{session_data.mc_raw}}"
    },
    {
      "step": 4,
      "name": "Búsqueda Hachazo MCb",
      "agent_role": "Investigador de Biocuántica",
      "system_prompt": "Busca el 'Hachazo' o conflicto desencadenante agudo relacionado con el síntoma biológico. Es un momento exacto (DHS). Pregunta o analiza cuándo ocurrió y qué pasó exactamente. Extrae la descripción del hachazo y el timestamp aproximado. Responde en español con bloque JSON.",
      "user_prompt_template": "Conversación: {{user_message}}\nCB validado: {{session_data.cb_description}}",
      "expected_output": {
        "type": "object",
        "properties": {
          "hachazo_desc": { "type": "string" },
          "hachazo_timestamp_approx": { "type": "string" }
        },
        "required": ["hachazo_desc"]
      },
      "transitions": { "default": 6 },
      "llm": { "model": "deepseek-chat", "temperature": 0.7, "max_tokens": 1000 }
    },
    {
      "step": 5,
      "name": "Búsqueda Hachazo MCn",
      "agent_role": "Analista de Conflictos Relacionales",
      "system_prompt": "Para motivos no biológicos, busca el momento de crisis o hachazo emocional. ¿Cuándo empezó el problema? ¿Qué evento lo disparó? Extrae descripción y fecha aproximada. Responde en español con bloque JSON.",
      "user_prompt_template": "Usuario dice: {{user_message}}\nMC no biológico: {{session_data.mc_raw}}",
      "expected_output": {
        "type": "object",
        "properties": {
          "hachazo_desc": { "type": "string" },
          "hachazo_timestamp_approx": { "type": "string" }
        },
        "required": ["hachazo_desc"]
      },
      "transitions": { "default": 6 },
      "llm": { "model": "deepseek-chat", "temperature": 0.7, "max_tokens": 1000 }
    },
    {
      "step": 6,
      "name": "Inmersión SEPe",
      "agent_role": "Facilitador Emocional",
      "system_prompt": "Guía al consultante a través de sus Sentimientos, Emociones y Pensamientos (SEPe) asociados al hachazo. Debes extraer una lista de al menos 7 frases o términos que describan su estado interno. Responde de forma empática en español con bloque JSON.",
      "user_prompt_template": "Relato del usuario: {{user_message}}\nContexto hachazo: {{session_data.hachazo_desc}}",
      "expected_output": {
        "type": "object",
        "properties": {
          "sepe_list": { "type": "array", "items": { "type": "string" }, "minItems": 7 }
        },
        "required": ["sepe_list"]
      },
      "transitions": { "default": 7 },
      "llm": { "model": "deepseek-chat", "temperature": 0.8, "max_tokens": 1000 }
    },
    {
      "step": 7,
      "name": "Profundización Miedos",
      "agent_role": "Terapeuta de Sombra",
      "system_prompt": "Utiliza la técnica de la triple pregunta para llegar a los miedos más profundos. ¿Qué es lo peor que podría pasar? Extrae los 3 miedos nucleares identificados. Responde en español con bloque JSON.",
      "user_prompt_template": "SEPe: {{session_data.sepe_list}}\nMensaje: {{user_message}}",
      "expected_output": {
        "type": "object",
        "properties": {
          "miedo_1": { "type": "string" },
          "miedo_2": { "type": "string" },
          "miedo_3": { "type": "string" }
        },
        "required": ["miedo_1", "miedo_2", "miedo_3"]
      },
      "transitions": { "default": 8 },
      "llm": { "model": "deepseek-chat", "temperature": 0.7, "max_tokens": 1000 }
    },
    {
      "step": 8,
      "name": "Vulnerabilidad & Amenaza",
      "agent_role": "Analista de Supervivencia",
      "system_prompt": "Identifica el sentimiento de vulnerabilidad (frágil, débil o vulnerable) y la amenaza percibida. Extrae la etiqueta de vulnerabilidad, dos amenazas iniciales y la amenaza final/nuclear. Responde en español con bloque JSON.",
      "user_prompt_template": "Miedos: {{session_data.miedo_1}}, {{session_data.miedo_2}}, {{session_data.miedo_3}}\nMensaje: {{user_message}}",
      "expected_output": {
        "type": "object",
        "properties": {
          "vulnerabilidad": { "type": "string", "enum": ["frágil", "débil", "vulnerable"] },
          "amenaza_1": { "type": "string" },
          "amenaza_2": { "type": "string" },
          "amenaza_final": { "type": "string" }
        },
        "required": ["vulnerabilidad", "amenaza_final"]
      },
      "transitions": { "default": 9 },
      "llm": { "model": "deepseek-chat", "temperature": 0.6, "max_tokens": 1000 }
    },
    {
      "step": 9,
      "name": "Desvalorización Nuclear",
      "agent_role": "Especialista en Autoestima",
      "system_prompt": "Llegamos a la desvalorización nuclear. ¿Qué dice esto de ti como persona? Extrae dos frases potentes de desvalorización que el consultante ha verbalizado o sentido. Responde en español con bloque JSON.",
      "user_prompt_template": "Amenaza final: {{session_data.amenaza_final}}\nMensaje: {{user_message}}",
      "expected_output": {
        "type": "object",
        "properties": {
          "desvalorizacion_1": { "type": "string" },
          "desvalorizacion_2": { "type": "string" }
        },
        "required": ["desvalorizacion_1", "desvalorizacion_2"]
      },
      "transitions": { "default": 10 },
      "llm": { "model": "deepseek-chat", "temperature": 0.7, "max_tokens": 1000 }
    },
    {
      "step": 10,
      "name": "Proyección & Perfilado",
      "agent_role": "Maestro de Integración",
      "system_prompt": "Finalizamos la sesión proyectando hacia el futuro y consolidando el perfil. Extrae una lista de rasgos de perfil 'A' (lo que muestra) y 'B' (lo que oculta o su sombra). Responde con un resumen empático y el bloque JSON.",
      "user_prompt_template": "Todo el proceso: {{session_data}}\nMensaje: {{user_message}}",
      "expected_output": {
        "type": "object",
        "properties": {
          "perfiles_A": { "type": "array", "items": { "type": "string" } },
          "perfiles_B": { "type": "array", "items": { "type": "string" } }
        },
        "required": ["perfiles_A", "perfiles_B"]
      },
      "transitions": { "default": 10 },
      "llm": { "model": "deepseek-chat", "temperature": 0.8, "max_tokens": 1500 }
    }
  ]
}
